{"$schema":"https://json-schema.org/draft/2020-12/schema","$id":"https://axm.tools/schemas/deep-tech-selection-receipt-v1.json","title":"AXM Deep-Tech Target Selection Receipt","type":"object","additionalProperties":false,"required":["schema","selection_id","target_id","target_label","selected_by","selected_at","sector_pack","automatic_selection"],"properties":{"schema":{"const":"axm/deep-tech-target-selection@1"},"selection_id":{"type":"string","minLength":1},"target_id":{"type":"string","minLength":1},"target_label":{"type":"string","minLength":1},"selected_by":{"type":"string","minLength":1},"selected_at":{"type":"string","minLength":1},"sector_pack":{"const":"AXM-DEEPTECH-001"},"automatic_selection":{"const":false},"notes":{"type":"string"}}}
