{"schema":"axm/deep-tech-target-selection@1","selection_id":"SEL-SYN-001","target_id":"SYNTHETIC-BOOT-001","target_label":"Helix Field Systems (synthetic)","selected_by":"synthetic-fixture","selected_at":"2026-09-07","sector_pack":"AXM-DEEPTECH-001","automatic_selection":false,"notes":"Synthetic bootstrap fixture only."}
